{
  "$description": "Design tokens for Harbour. Generated by Design Wizard.",
  "$extensions": {
    "com.github.mikkelstaehr.design-wizard": {
      "schemaVersion": 1,
      "project": "Harbour",
      "theme": "light"
    }
  },
  "color": {
    "bg": {
      "$type": "color",
      "$value": {
        "colorSpace": "srgb",
        "components": [
          0.9098,
          0.9804,
          0.9725
        ],
        "alpha": 1,
        "hex": "#E8FAF8"
      }
    },
    "surface": {
      "$type": "color",
      "$value": {
        "colorSpace": "srgb",
        "components": [
          1,
          1,
          1
        ],
        "alpha": 1,
        "hex": "#FFFFFF"
      }
    },
    "border": {
      "$type": "color",
      "$value": {
        "colorSpace": "srgb",
        "components": [
          0.4118,
          0.5882,
          0.5686
        ],
        "alpha": 1,
        "hex": "#699691"
      }
    },
    "text": {
      "$type": "color",
      "$value": {
        "colorSpace": "srgb",
        "components": [
          0.0078,
          0.1451,
          0.1333
        ],
        "alpha": 1,
        "hex": "#022522"
      }
    },
    "text-muted": {
      "$type": "color",
      "$value": {
        "colorSpace": "srgb",
        "components": [
          0.3059,
          0.4431,
          0.4235
        ],
        "alpha": 1,
        "hex": "#4E716C"
      }
    },
    "accent": {
      "$type": "color",
      "$value": {
        "colorSpace": "srgb",
        "components": [
          0.0588,
          0.4627,
          0.4314
        ],
        "alpha": 1,
        "hex": "#0F766E"
      }
    },
    "on-accent": {
      "$type": "color",
      "$value": {
        "colorSpace": "srgb",
        "components": [
          1,
          1,
          1
        ],
        "alpha": 1,
        "hex": "#FFFFFF"
      }
    },
    "positive": {
      "$type": "color",
      "$value": {
        "colorSpace": "srgb",
        "components": [
          0.1137,
          0.4902,
          0.2431
        ],
        "alpha": 1,
        "hex": "#1D7D3E"
      }
    },
    "warning": {
      "$type": "color",
      "$value": {
        "colorSpace": "srgb",
        "components": [
          0.6431,
          0.3804,
          0
        ],
        "alpha": 1,
        "hex": "#A46100"
      }
    },
    "negative": {
      "$type": "color",
      "$value": {
        "colorSpace": "srgb",
        "components": [
          0.7608,
          0.1569,
          0.149
        ],
        "alpha": 1,
        "hex": "#C22826"
      }
    },
    "focus": {
      "$type": "color",
      "$value": {
        "colorSpace": "srgb",
        "components": [
          0.0588,
          0.4627,
          0.4314
        ],
        "alpha": 1,
        "hex": "#0F766E"
      }
    }
  },
  "font": {
    "display": {
      "$type": "fontFamily",
      "$value": [
        "Sora",
        "sans-serif"
      ],
      "$extensions": {
        "com.github.mikkelstaehr.design-wizard": {
          "catalogueId": "sora",
          "fontsource": "@fontsource/sora",
          "weights": [
            600,
            700
          ],
          "style": "normal",
          "subset": "latin",
          "license": "OFL-1.1",
          "copyright": "Copyright 2019 The Sora Project Authors (https://github.com/sora-xor/sora-font)"
        }
      }
    },
    "text": {
      "$type": "fontFamily",
      "$value": [
        "Inter",
        "sans-serif"
      ],
      "$extensions": {
        "com.github.mikkelstaehr.design-wizard": {
          "catalogueId": "inter",
          "fontsource": "@fontsource/inter",
          "weights": [
            400,
            500,
            600
          ],
          "style": "normal",
          "subset": "latin",
          "license": "OFL-1.1",
          "copyright": "Copyright 2016 The Inter Project Authors (https://github.com/rsms/inter)"
        }
      }
    }
  },
  "font-size": {
    "xs": {
      "$type": "dimension",
      "$value": {
        "value": 0.6875,
        "unit": "rem"
      }
    },
    "sm": {
      "$type": "dimension",
      "$value": {
        "value": 0.75,
        "unit": "rem"
      }
    },
    "base": {
      "$type": "dimension",
      "$value": {
        "value": 0.8125,
        "unit": "rem"
      }
    },
    "lg": {
      "$type": "dimension",
      "$value": {
        "value": 0.9375,
        "unit": "rem"
      }
    },
    "xl": {
      "$type": "dimension",
      "$value": {
        "value": 1.25,
        "unit": "rem"
      }
    },
    "2xl": {
      "$type": "dimension",
      "$value": {
        "value": 1.5625,
        "unit": "rem"
      }
    },
    "3xl": {
      "$type": "dimension",
      "$value": {
        "value": 2,
        "unit": "rem"
      }
    }
  },
  "line-height": {
    "text": {
      "$type": "number",
      "$value": 1.5
    },
    "display": {
      "$type": "number",
      "$value": 1.2
    }
  },
  "radius": {
    "base": {
      "$type": "dimension",
      "$value": {
        "value": 8,
        "unit": "px"
      }
    }
  },
  "space": {
    "1": {
      "$type": "dimension",
      "$value": {
        "value": 4,
        "unit": "px"
      }
    },
    "2": {
      "$type": "dimension",
      "$value": {
        "value": 8,
        "unit": "px"
      }
    },
    "3": {
      "$type": "dimension",
      "$value": {
        "value": 12,
        "unit": "px"
      }
    },
    "4": {
      "$type": "dimension",
      "$value": {
        "value": 16,
        "unit": "px"
      }
    },
    "6": {
      "$type": "dimension",
      "$value": {
        "value": 24,
        "unit": "px"
      }
    },
    "8": {
      "$type": "dimension",
      "$value": {
        "value": 32,
        "unit": "px"
      }
    },
    "12": {
      "$type": "dimension",
      "$value": {
        "value": 48,
        "unit": "px"
      }
    },
    "16": {
      "$type": "dimension",
      "$value": {
        "value": 64,
        "unit": "px"
      }
    }
  }
}
