{
  "$description": "Design tokens for Harbour. Generated by Design Wizard.",
  "$extensions": {
    "com.github.mikkelstaehr.design-wizard": {
      "schemaVersion": 1,
      "project": "Harbour",
      "theme": "light"
    }
  },
  "color": {
    "bg": {
      "$type": "color",
      "$value": {
        "colorSpace": "srgb",
        "components": [
          0.102,
          0.102,
          0.0784
        ],
        "alpha": 1,
        "hex": "#1A1A14"
      }
    },
    "surface": {
      "$type": "color",
      "$value": {
        "colorSpace": "srgb",
        "components": [
          0.149,
          0.149,
          0.1137
        ],
        "alpha": 1,
        "hex": "#26261D"
      }
    },
    "border": {
      "$type": "color",
      "$value": {
        "colorSpace": "srgb",
        "components": [
          0.549,
          0.549,
          0.4392
        ],
        "alpha": 1,
        "hex": "#8C8C70"
      }
    },
    "text": {
      "$type": "color",
      "$value": {
        "colorSpace": "srgb",
        "components": [
          0.9608,
          0.9608,
          0.902
        ],
        "alpha": 1,
        "hex": "#F5F5E6"
      }
    },
    "text-muted": {
      "$type": "color",
      "$value": {
        "colorSpace": "srgb",
        "components": [
          0.7412,
          0.7412,
          0.651
        ],
        "alpha": 1,
        "hex": "#BDBDA6"
      }
    },
    "accent": {
      "$type": "color",
      "$value": {
        "colorSpace": "srgb",
        "components": [
          0.902,
          0.902,
          0
        ],
        "alpha": 1,
        "hex": "#E6E600"
      }
    },
    "on-accent": {
      "$type": "color",
      "$value": {
        "colorSpace": "srgb",
        "components": [
          0.102,
          0.102,
          0
        ],
        "alpha": 1,
        "hex": "#1A1A00"
      }
    },
    "positive": {
      "$type": "color",
      "$value": {
        "colorSpace": "srgb",
        "components": [
          0.5255,
          0.9373,
          0.6745
        ],
        "alpha": 1,
        "hex": "#86EFAC"
      }
    },
    "warning": {
      "$type": "color",
      "$value": {
        "colorSpace": "srgb",
        "components": [
          0.9882,
          0.8275,
          0.302
        ],
        "alpha": 1,
        "hex": "#FCD34D"
      }
    },
    "negative": {
      "$type": "color",
      "$value": {
        "colorSpace": "srgb",
        "components": [
          0.9882,
          0.6471,
          0.6471
        ],
        "alpha": 1,
        "hex": "#FCA5A5"
      }
    },
    "focus": {
      "$type": "color",
      "$value": {
        "colorSpace": "srgb",
        "components": [
          0.902,
          0.902,
          0
        ],
        "alpha": 1,
        "hex": "#E6E600"
      }
    }
  },
  "font": {
    "display": {
      "$type": "fontFamily",
      "$value": [
        "Sora",
        "sans-serif"
      ],
      "$extensions": {
        "com.github.mikkelstaehr.design-wizard": {
          "catalogueId": "sora",
          "fontsource": "@fontsource/sora",
          "weights": [
            600,
            700
          ],
          "style": "normal",
          "subset": "latin",
          "license": "OFL-1.1",
          "copyright": "Copyright 2019 The Sora Project Authors (https://github.com/sora-xor/sora-font)"
        }
      }
    },
    "text": {
      "$type": "fontFamily",
      "$value": [
        "Inter",
        "sans-serif"
      ],
      "$extensions": {
        "com.github.mikkelstaehr.design-wizard": {
          "catalogueId": "inter",
          "fontsource": "@fontsource/inter",
          "weights": [
            400,
            500,
            600
          ],
          "style": "normal",
          "subset": "latin",
          "license": "OFL-1.1",
          "copyright": "Copyright 2016 The Inter Project Authors (https://github.com/rsms/inter)"
        }
      }
    }
  },
  "font-size": {
    "xs": {
      "$type": "dimension",
      "$value": {
        "value": 0.6875,
        "unit": "rem"
      }
    },
    "sm": {
      "$type": "dimension",
      "$value": {
        "value": 0.75,
        "unit": "rem"
      }
    },
    "base": {
      "$type": "dimension",
      "$value": {
        "value": 0.8125,
        "unit": "rem"
      }
    },
    "lg": {
      "$type": "dimension",
      "$value": {
        "value": 0.9375,
        "unit": "rem"
      }
    },
    "xl": {
      "$type": "dimension",
      "$value": {
        "value": 1.25,
        "unit": "rem"
      }
    },
    "2xl": {
      "$type": "dimension",
      "$value": {
        "value": 1.5625,
        "unit": "rem"
      }
    },
    "3xl": {
      "$type": "dimension",
      "$value": {
        "value": 2,
        "unit": "rem"
      }
    }
  },
  "line-height": {
    "text": {
      "$type": "number",
      "$value": 1.5
    },
    "display": {
      "$type": "number",
      "$value": 1.2
    }
  },
  "radius": {
    "base": {
      "$type": "dimension",
      "$value": {
        "value": 8,
        "unit": "px"
      }
    }
  },
  "space": {
    "1": {
      "$type": "dimension",
      "$value": {
        "value": 4,
        "unit": "px"
      }
    },
    "2": {
      "$type": "dimension",
      "$value": {
        "value": 8,
        "unit": "px"
      }
    },
    "3": {
      "$type": "dimension",
      "$value": {
        "value": 12,
        "unit": "px"
      }
    },
    "4": {
      "$type": "dimension",
      "$value": {
        "value": 16,
        "unit": "px"
      }
    },
    "6": {
      "$type": "dimension",
      "$value": {
        "value": 24,
        "unit": "px"
      }
    },
    "8": {
      "$type": "dimension",
      "$value": {
        "value": 32,
        "unit": "px"
      }
    },
    "12": {
      "$type": "dimension",
      "$value": {
        "value": 48,
        "unit": "px"
      }
    },
    "16": {
      "$type": "dimension",
      "$value": {
        "value": 64,
        "unit": "px"
      }
    }
  }
}
